{"base_active_agent_tool_manifest_hash":"sha256:0d105c4ed1c8ad4c2f22fd590f0e76057f17ec7b034fa999c2c94dfd6b9e192d","base_agent_data_route_manifest_hash":"sha256:6c28d1edaf20e49d7943073b7951608f797f244df15af1385a836a1a71bbbad7","capability_binding_manifest_hash":"sha256:07a835a5c67a6b7d5260e27f74ceeb9ab801d2aa651f9c682cc11c38346cbbca","manifest_hash":"sha256:a461f8e0ab8663367b8b399f8700eef62dcefbf3bc694fd79ff75699f4d863e4","schema_version":"staged_agent_tool_contract_manifest_v2","tools":[{"activation_state":"staged","adaptive_query_contract":{"max_rounds":3,"model_selects_arguments":true,"transport_allowed_during_call":false,"transport_allowed_during_prepare":true},"agent_id":"ackman","argument_schema_hash":"sha256:5e1692860202d8af91a1a6123cacc34ca62115c8bfec5b27ddd8afddb437e150","authorized_query_domain_hash":"sha256:2a9f480cdca38c4f1d5e7363a29837c77d139e228bc9c964c7f96ed948049eed","capability_binding_ids":["binding:67158abf625377579c9179528740d66f0be853965c20d54394ae976ebe4a1773"],"materializer_contract_hash":"sha256:ec125d7ff8003a10a1ab5305b19876870834285a3f7d93541cd3a0b573d686a2","output_semantics_hash":"sha256:c7f72711772194cef178cad54a033f2350818f95f9c1c7ee41e61764dcecd531","phase":"analysis","privacy_contract_hash":"sha256:f3c60ce1ba67bc831588f5bcce518f457cd101fb5d66284be9a278591d40a3e0","query_bundle_contract_version":"frozen_bound_runtime_query_bundle_v1","route_contract_hash":"sha256:873bab55d0bcb0e16da85109bcd31e47eab2ffde16e1d61c401f87e7ed38d9b7","semantic_capability_ids":["balance_sheet"],"source_route_ids":["tushare.sector_fundamentals"],"stage":"ackman","tool_id":"get_balance_sheet"},{"activation_state":"staged","adaptive_query_contract":{"max_rounds":3,"model_selects_arguments":true,"transport_allowed_during_call":false,"transport_allowed_during_prepare":true},"agent_id":"ackman","argument_schema_hash":"sha256:5e1692860202d8af91a1a6123cacc34ca62115c8bfec5b27ddd8afddb437e150","authorized_query_domain_hash":"sha256:923e8f07c0a12f08638a0712c21c6de80731fbd36827edb5caab40211e8d49fb","capability_binding_ids":["binding:faaa1a1924fd293f67f0e78ed711e6d7cd174070d8a554a1fb2c10ff3f551092"],"materializer_contract_hash":"sha256:d97cf7f34b94c813ac678fe53ca1bf1a29646026fccd838d9969d09d12fbebce","output_semantics_hash":"sha256:ce0bd66d2d1a95ed96f3e097586d753864b0b1fd6a53b3141d30bdccb2ae9d27","phase":"analysis","privacy_contract_hash":"sha256:f3c60ce1ba67bc831588f5bcce518f457cd101fb5d66284be9a278591d40a3e0","query_bundle_contract_version":"frozen_bound_runtime_query_bundle_v1","route_contract_hash":"sha256:873bab55d0bcb0e16da85109bcd31e47eab2ffde16e1d61c401f87e7ed38d9b7","semantic_capability_ids":["cashflow_statement"],"source_route_ids":["tushare.sector_fundamentals"],"stage":"ackman","tool_id":"get_cashflow"},{"activation_state":"staged","adaptive_query_contract":{"max_rounds":3,"model_selects_arguments":true,"transport_allowed_during_call":false,"transport_allowed_during_prepare":true},"agent_id":"ackman","argument_schema_hash":"sha256:4849dd47aae764f3be782f9e312051d7b81b50e533718c4a122133539bbf2814","authorized_query_domain_hash":"sha256:4eb35bf9ca8317b4e0f7b804afbd727501c7c7c8787b7ee724a6d6332eff7c01","capability_binding_ids":["binding:4abe652cbd767a020da761d0b61c6f70d506b05c5533a128b0970a4f96a40cd1"],"materializer_contract_hash":"sha256:30efb32788d1c89f1f041998e1dc7cc85aac81f7e14ec1e14e6e1d562becf606","output_semantics_hash":"sha256:198040878f622b89a031b12690b80a23e82b8dda700c430c7d4e8646ee23b144","phase":"analysis","privacy_contract_hash":"sha256:f3c60ce1ba67bc831588f5bcce518f457cd101fb5d66284be9a278591d40a3e0","query_bundle_contract_version":"frozen_bound_runtime_query_bundle_v1","route_contract_hash":"sha256:873bab55d0bcb0e16da85109bcd31e47eab2ffde16e1d61c401f87e7ed38d9b7","semantic_capability_ids":["fundamentals"],"source_route_ids":["tushare.sector_fundamentals"],"stage":"ackman","tool_id":"get_fundamentals"},{"activation_state":"staged","adaptive_query_contract":{"max_rounds":3,"model_selects_arguments":true,"transport_allowed_during_call":false,"transport_allowed_during_prepare":true},"agent_id":"ackman","argument_schema_hash":"sha256:5e1692860202d8af91a1a6123cacc34ca62115c8bfec5b27ddd8afddb437e150","authorized_query_domain_hash":"sha256:e6263e2919fed61bae88536bcf6241fb7a179fb69b8fe0526c0074551dc60a33","capability_binding_ids":["binding:598c1d67702cf71d41147d3a8db30ea3d27ac3f284d9b5587fe2a8ddce36f3a8"],"materializer_contract_hash":"sha256:ac94c15cf5dd70caadc09a207dad3495c6d98870f4d8797d1d5f2ac17b3c9214","output_semantics_hash":"sha256:a3df4c76775ff19cc7a32b061003df5811745fbfabaaf7adf577f443eadb20a2","phase":"analysis","privacy_contract_hash":"sha256:f3c60ce1ba67bc831588f5bcce518f457cd101fb5d66284be9a278591d40a3e0","query_bundle_contract_version":"frozen_bound_runtime_query_bundle_v1","route_contract_hash":"sha256:873bab55d0bcb0e16da85109bcd31e47eab2ffde16e1d61c401f87e7ed38d9b7","semantic_capability_ids":["income_statement"],"source_route_ids":["tushare.sector_fundamentals"],"stage":"ackman","tool_id":"get_income_statement"},{"activation_state":"staged","adaptive_query_contract":{"max_rounds":3,"model_selects_arguments":true,"transport_allowed_during_call":false,"transport_allowed_during_prepare":true},"agent_id":"ackman","argument_schema_hash":"sha256:d23f2b393b4a6bce2dd3dfd8b2b3d46eeec70a5f4e61a4d1758fe69b6504e884","authorized_query_domain_hash":"sha256:461782c796503b217883191e2b92680d5d742542555fc344ec18a025319a2495","capability_binding_ids":["binding:1e798223b094d55b245cff086d9512ff04b045f7f7143b544c9d20a67335eae4"],"materializer_contract_hash":"sha256:d4a225e080c933f23f6d485a2f5da6955a6b96247d4c00c66c114e7a6a0578ab","output_semantics_hash":"sha256:f51d2fb4e47a0f4f07756bf7599be04de26876a38f8adb99c458d755f54a24ac","phase":"analysis","privacy_contract_hash":"sha256:74c7d657db7e4e07280854d4e8692c8b8277ee1fe2acd54bf117518c09b3670c","query_bundle_contract_version":"frozen_bound_runtime_query_bundle_v1","route_contract_hash":"sha256:c3bb60bc02815bb658ed5ee06a7a3dceb6cc705be637ca50efaaffeeac0bbdee","semantic_capability_ids":["rke_research_context"],"source_route_ids":["private.rke_report_intelligence"],"stage":"ackman","tool_id":"get_rke_research_context"},{"activation_state":"staged","adaptive_query_contract":{"max_rounds":3,"model_selects_arguments":true,"transport_allowed_during_call":false,"transport_allowed_during_prepare":true},"agent_id":"ackman","argument_schema_hash":"sha256:79ea8f7f8c76e7c5f6a074c85f77dc95cafdc4f391e638b8ed7c6294d0bc945a","authorized_query_domain_hash":"sha256:f7c60b14d390a6d8fcb387bacb8072d791ab466f9087be52df251dbdf76bf750","capability_binding_ids":["binding:c1288d45a88687a43ec622b86bf63fef31fd9010880431bb330d41c1f99934f2"],"materializer_contract_hash":"sha256:ea72519abb63d25e64d8f042ba968bb13b6bf901e22717ea8487a18ca5cc2a76","output_semantics_hash":"sha256:a8f2196df5d13cbc77d324345565cb0484ac3eb98242c6182feb55349e4704a2","phase":"analysis","privacy_contract_hash":"sha256:f3c60ce1ba67bc831588f5bcce518f457cd101fb5d66284be9a278591d40a3e0","query_bundle_contract_version":"frozen_bound_runtime_query_bundle_v1","route_contract_hash":"sha256:e1f4ad7b18aeb8df96707887dcf6f472502ffea99c80199bd6bc3e03ae22b864","semantic_capability_ids":["stock_data"],"source_route_ids":["tushare.sector_market"],"stage":"ackman","tool_id":"get_stock_data"},{"activation_state":"staged","adaptive_query_contract":{"max_rounds":3,"model_selects_arguments":true,"transport_allowed_during_call":false,"transport_allowed_during_prepare":true},"agent_id":"ackman","argument_schema_hash":"sha256:5583040247dcc139571e595a1a61d9849086d4ba0cb5d0f9cd9f345033d5480a","authorized_query_domain_hash":"sha256:9cfc6f281175601d9ce311ba0f3c3893ac9f576e0310745303b18fae08d39345","capability_binding_ids":["binding:6c99ef54c885eb9036ab97177b8ebf0488be460d1a332a2e46f131919c67d13f"],"materializer_contract_hash":"sha256:6c359745529f62fdc04508880805cf322fad433455c42fd86dd6c4efda4dcd83","output_semantics_hash":"sha256:8753eb326b5e6e91ac80319244e84bb34fcfbbd8d5383e7e1611a29f0bae9f6e","phase":"analysis","privacy_contract_hash":"sha256:20f38d435bf6a610af7e8c8ee0207d7575dc1f51ab5e40c2f91dc32a60d9ecfb","query_bundle_contract_version":"frozen_bound_runtime_query_bundle_v1","route_contract_hash":"sha256:732a48ebac1fba1a1970d011f25083fc2172b1ad7ba5c7fb6a395d940eed0721","semantic_capability_ids":["stock_research"],"source_route_ids":["private.tushare_research_reports"],"stage":"ackman","tool_id":"get_stock_research"},{"activation_state":"staged","adaptive_query_contract":{"max_rounds":0,"model_selects_arguments":false,"transport_allowed_during_call":false},"agent_id":"ackman","argument_schema_hash":"sha256:99334726611ccf58a148b0814696bfa6fe08c1b2d027e946beccf5a74331c9aa","authorized_query_domain_hash":"sha256:547c260dadd0ccbeda7c4fef15b75890a295f2053edd6e45927b1da832e0fb48","capability_binding_ids":["binding:edb6cf38f4ccb537ba55fa5ca89da618d80ad7ac5fdc1c3bf139567a4ab13f47"],"materializer_contract_hash":"sha256:47b12246316d4d43a477adc9aaac075f5beeb8429a84df6994c34f92e0ec8fe4","output_semantics_hash":"sha256:d67ba25eed96a69355ebc8a481ffd79135cbe0304cf28c4c600154686af25223","phase":"analysis","privacy_contract_hash":"sha256:947d8dca69f2c876ec002c5ad31075d2f63d93eceecc668ab4ac5f29f773a599","query_bundle_contract_version":"frozen_snapshot_query_v1","route_contract_hash":"sha256:f5324a87e072c6c44bb93dbe542c27e9ae12ce0d7c6cb254d5d570d03935cec6","semantic_capability_ids":["superinvestor_candidate_scope"],"source_route_ids":["runtime.accepted_outputs","runtime.candidate_scope"],"stage":"ackman","tool_id":"get_superinvestor_candidate_snapshot"},{"activation_state":"staged","adaptive_query_contract":{"max_rounds":3,"model_selects_arguments":true,"transport_allowed_during_call":false,"transport_allowed_during_prepare":true},"agent_id":"agriculture","argument_schema_hash":"sha256:045352bef947c97544470b2bb03fc3430161d49bcf64ccb77c55214041421e6a","authorized_query_domain_hash":"sha256:d665e30084f23b5ceab42b9b2f8118fe38ac644c0c3b5cac037b1c4743e3a07f","capability_